{
  "$schema": "https://json-schema.org/draft/2020-12/schema",
  "title": "ai_supervisor review report",
  "type": "object",
  "additionalProperties": false,
  "required": [
    "task_id",
    "verdict",
    "summary",
    "blocking_findings",
    "non_blocking_findings",
    "scope_violations",
    "recommended_action"
  ],
  "properties": {
    "task_id": {
      "type": "string"
    },
    "verdict": {
      "type": "string",
      "enum": [
        "approve",
        "rework",
        "reject"
      ]
    },
    "summary": {
      "type": "string",
      "minLength": 1
    },
    "blocking_findings": {
      "type": "array",
      "items": {
        "type": "object",
        "additionalProperties": false,
        "required": [
          "title",
          "detail"
        ],
        "properties": {
          "title": {
            "type": "string"
          },
          "detail": {
            "type": "string"
          },
          "file": {
            "type": "string"
          }
        }
      }
    },
    "non_blocking_findings": {
      "type": "array",
      "items": {
        "type": "object",
        "additionalProperties": false,
        "required": [
          "title",
          "detail"
        ],
        "properties": {
          "title": {
            "type": "string"
          },
          "detail": {
            "type": "string"
          },
          "file": {
            "type": "string"
          }
        }
      }
    },
    "scope_violations": {
      "type": "array",
      "items": {
        "type": "string"
      }
    },
    "recommended_action": {
      "type": "string",
      "minLength": 1
    }
  }
}
